{
  "schema_version": "1",
  "target_role": "developer",
  "skill_id": "developer.code-task-v1",
  "input_references": [
    {
      "schema_version": "1",
      "reference_id": "code-task-1",
      "uri": "evidence://task-1/attempt-1/input/code-task-1",
      "digest": "bbbbbbbbbbbbbbbbbbbbbbbbbbbbbbbbbbbbbbbbbbbbbbbbbbbbbbbbbbbbbbbb",
      "size_bytes": 4096,
      "media_type": "application/json",
      "classification": "INTERNAL",
      "contract": "code-task-v1",
      "contract_version": "1"
    }
  ],
  "constraints": {
    "expected_output_contract": "patch-proposal-v1",
    "allowed_reference_ids": ["code-task-1"],
    "max_input_bytes": 1048576,
    "deadline": "2026-09-06T15:00:00Z"
  },
  "budget": {
    "max_turns": 6,
    "max_tokens": 12000,
    "max_cost_micros": 12000000,
    "timeout_seconds": 900,
    "max_tool_calls": 24
  }
}
